{
  "schema": "roadmap-readiness-assessment-v1",
  "version": 1,
  "assessment_id": "RAD11-CORE-READY-V1",
  "topic": {
    "id": "11-can-thuc",
    "title": "Chuyên đề 11 – Căn thức và biến đổi căn thức"
  },
  "layer": "KNTT-Core",
  "title": "Core Readiness Check – Chuyên đề 11 – Căn thức và biến đổi căn thức",
  "skill_labels": {
    "can-bac-hai-so-hoc": "Căn bậc hai số học",
    "dkxd-can": "Điều kiện xác định",
    "can-binh-phuong": "Căn của bình phương",
    "khai-phuong-tich": "Khai phương tích",
    "dua-thua-so-ra": "Đưa thừa số ra",
    "dua-thua-so-vao": "Đưa thừa số vào",
    "can-dong-dang": "Căn đồng dạng",
    "truc-can-lien-hop": "Trục căn liên hợp",
    "can-bac-ba": "Căn bậc ba"
  },
  "policy": {
    "feedback": "after_submit",
    "hints": false,
    "tutor": false,
    "hard_gate": false,
    "target_minutes": 20,
    "allow_partial_submit": true
  },
  "readiness": {
    "ready_threshold": 0.8,
    "minimum_answered_ratio": 0.8,
    "hard_gate": false,
    "states": [
      "READY",
      "REVIEW_RECOMMENDED",
      "MORE_EVIDENCE_NEEDED"
    ]
  },
  "items": [
    {
      "id": "RAD11READY_001",
      "type": "mcq",
      "skill": "can-bac-hai-so-hoc",
      "points": 1,
      "question": "\\(\\sqrt{121}=\\)",
      "options": [
        "11",
        "-11",
        "±11",
        "121"
      ],
      "answer": 0,
      "explanation": "Căn bậc hai số học là 11."
    },
    {
      "id": "RAD11READY_002",
      "type": "mcq",
      "skill": "dkxd-can",
      "points": 1,
      "question": "Điều kiện của \\(\\sqrt{x-4}\\) là:",
      "options": [
        "\\(x\\ge4\\)",
        "\\(x>4\\)",
        "\\(x\\le4\\)",
        "Mọi x"
      ],
      "answer": 0,
      "explanation": "Cần x-4≥0."
    },
    {
      "id": "RAD11READY_003",
      "type": "mcq",
      "skill": "can-binh-phuong",
      "points": 1,
      "question": "\\(\\sqrt{(x+1)^2}=\\)",
      "options": [
        "\\(|x+1|\\)",
        "\\(x+1\\)",
        "\\(-x-1\\)",
        "±(x+1)"
      ],
      "answer": 0,
      "explanation": "Dùng √(A²)=|A|."
    },
    {
      "id": "RAD11READY_004",
      "type": "mcq",
      "skill": "khai-phuong-tich",
      "points": 1,
      "question": "\\(\\sqrt8\\cdot\\sqrt2=\\)",
      "options": [
        "4",
        "16",
        "\\(2\\sqrt2\\)",
        "\\(\\sqrt6\\)"
      ],
      "answer": 0,
      "explanation": "√16=4."
    },
    {
      "id": "RAD11READY_005",
      "type": "mcq",
      "skill": "dua-thua-so-ra",
      "points": 1,
      "question": "Rút gọn \\(\\sqrt{75}\\).",
      "options": [
        "\\(5\\sqrt3\\)",
        "\\(3\\sqrt5\\)",
        "\\(15\\sqrt3\\)",
        "25"
      ],
      "answer": 0,
      "explanation": "75=25·3."
    },
    {
      "id": "RAD11READY_006",
      "type": "mcq",
      "skill": "dua-thua-so-vao",
      "points": 1,
      "question": "\\(2\\sqrt7\\) viết dưới một dấu căn là:",
      "options": [
        "\\(\\sqrt{28}\\)",
        "\\(\\sqrt{14}\\)",
        "\\(\\sqrt9\\)",
        "\\(\\sqrt{49}\\)"
      ],
      "answer": 0,
      "explanation": "2√7=√28."
    },
    {
      "id": "RAD11READY_007",
      "type": "mcq",
      "skill": "can-dong-dang",
      "points": 1,
      "question": "\\(\\sqrt{20}+\\sqrt{45}=\\)",
      "options": [
        "\\(5\\sqrt5\\)",
        "\\(\\sqrt{65}\\)",
        "\\(7\\sqrt5\\)",
        "5"
      ],
      "answer": 0,
      "explanation": "2√5+3√5=5√5."
    },
    {
      "id": "RAD11READY_008",
      "type": "mcq",
      "skill": "truc-can-lien-hop",
      "points": 1,
      "question": "\\(\\dfrac1{\\sqrt2+1}=\\)",
      "options": [
        "\\(\\sqrt2-1\\)",
        "\\(\\sqrt2+1\\)",
        "\\(\\dfrac{\\sqrt2+1}{3}\\)",
        "1"
      ],
      "answer": 0,
      "explanation": "Nhân liên hợp."
    },
    {
      "id": "RAD11READY_009",
      "type": "mcq",
      "skill": "can-bac-ba",
      "points": 1,
      "question": "\\(\\sqrt[3]{-125}=\\)",
      "options": [
        "-5",
        "5",
        "Không xác định",
        "±5"
      ],
      "answer": 0,
      "explanation": "(-5)³=-125."
    },
    {
      "id": "RAD11READY_010",
      "type": "mcq",
      "skill": "can-bac-ba",
      "points": 1,
      "question": "Với mọi x thực, \\(\\sqrt[3]{x^3}=\\)",
      "options": [
        "x",
        "|x|",
        "x²",
        "±x"
      ],
      "answer": 0,
      "explanation": "Căn bậc ba đảo phép lập phương."
    }
  ],
  "next_topic": {
    "id": "12-phuong-trinh-bac-hai-viete",
    "title": "Chuyên đề 12 – Phương trình bậc hai & Viète"
  }
}
