{
  "schema": "roadmap-readiness-assessment-v1",
  "version": 1,
  "assessment_id": "RAT07-CORE-READY-V1",
  "topic": {
    "id": "07-phan-thuc-dai-so",
    "title": "Phân thức đại số"
  },
  "layer": "KNTT-Core",
  "title": "Core Readiness Check – Chuyên đề 07",
  "skill_labels": {
    "dieu-kien-xac-dinh": "Điều kiện xác định",
    "hai-phan-thuc-bang-nhau": "Hai phân thức bằng nhau",
    "rut-gon-phan-thuc": "Rút gọn phân thức",
    "doi-dau-phan-thuc": "Đổi dấu phân thức",
    "quy-dong-mau-thuc": "Quy đồng mẫu thức",
    "cong-tru-phan-thuc": "Cộng – trừ phân thức",
    "nhan-phan-thuc": "Nhân phân thức",
    "chia-phan-thuc": "Chia phân thức",
    "tinh-gia-tri-phan-thuc": "Tính giá trị phân thức",
    "giu-dieu-kien-ban-dau": "Bảo toàn điều kiện xác định"
  },
  "policy": {
    "feedback": "after_submit",
    "hints": false,
    "tutor": false,
    "hard_gate": false,
    "target_minutes": 20,
    "allow_partial_submit": true
  },
  "readiness": {
    "ready_threshold": 0.8,
    "minimum_answered_ratio": 0.8,
    "hard_gate": false,
    "states": [
      "READY",
      "REVIEW_RECOMMENDED",
      "MORE_EVIDENCE_NEEDED"
    ]
  },
  "items": [
    {
      "id": "RAT07READY_001",
      "type": "mcq",
      "skill": "dieu-kien-xac-dinh",
      "points": 1,
      "question": "Điều kiện xác định của \\(\\frac{x+1}{(x-2)(x+3)}\\) là:",
      "options": [
        "\\(x\\ne2\\) và \\(x\\ne-3\\)",
        "\\(x\\ne-1\\)",
        "\\(x\\ne2\\)",
        "Mọi \\(x\\)"
      ],
      "answer": 0,
      "explanation": "Mẫu phải khác 0 nên loại cả hai nghiệm của mẫu: \\(x=2\\) và \\(x=-3\\)."
    },
    {
      "id": "RAT07READY_002",
      "type": "mcq",
      "skill": "hai-phan-thuc-bang-nhau",
      "points": 1,
      "question": "Khẳng định nào đúng về \\(\\frac{x+1}{x-2}\\) và \\(\\frac{2x+2}{2x-4}\\)?",
      "options": [
        "Hai phân thức bằng nhau trên miền \\(x\\ne2\\).",
        "Hai phân thức chỉ bằng nhau khi \\(x=0\\).",
        "Hai phân thức không bao giờ bằng nhau.",
        "Có thể coi chúng bằng nhau với mọi \\(x\\)."
      ],
      "answer": 0,
      "explanation": "Tử và mẫu của phân thức thứ hai cùng gấp đôi phân thức thứ nhất; hai biểu thức bằng nhau trên miền xác định chung \\(x\\ne2\\)."
    },
    {
      "id": "RAT07READY_003",
      "type": "mcq",
      "skill": "rut-gon-phan-thuc",
      "supporting_skills": [
        "hieu-hai-binh-phuong"
      ],
      "points": 1,
      "question": "Rút gọn \\(\\frac{x^2-9}{x-3}\\) với \\(x\\ne3\\).",
      "options": [
        "\\(x+3\\)",
        "\\(x-3\\)",
        "\\(x^2+3\\)",
        "\\(1\\)"
      ],
      "answer": 0,
      "explanation": "\\(x^2-9=(x-3)(x+3)\\), nên rút nhân tử \\(x-3\\) được \\(x+3\\), vẫn giữ \\(x\\ne3\\)."
    },
    {
      "id": "RAT07READY_004",
      "type": "mcq",
      "skill": "doi-dau-phan-thuc",
      "points": 1,
      "question": "Viết \\(\\frac1{3-x}\\) theo mẫu \\(x-3\\).",
      "options": [
        "\\(-\\frac1{x-3}\\)",
        "\\(\\frac1{x-3}\\)",
        "\\(-\\frac1{x+3}\\)",
        "\\(\\frac{x-3}{1}\\)"
      ],
      "answer": 0,
      "explanation": "Vì \\(3-x=-(x-3)\\), nên \\(\\frac1{3-x}=-\\frac1{x-3}\\)."
    },
    {
      "id": "RAT07READY_005",
      "type": "mcq",
      "skill": "quy-dong-mau-thuc",
      "points": 1,
      "question": "Mẫu thức chung nhỏ nhất của \\(\\frac1{2x}\\) và \\(\\frac1{x(x-1)}\\) là:",
      "options": [
        "\\(2x(x-1)\\)",
        "\\(2x^2(x-1)\\)",
        "\\(x(x-1)\\)",
        "\\(2x\\)"
      ],
      "answer": 0,
      "explanation": "MTC phải chia hết cho cả \\(2x\\) và \\(x(x-1)\\), nên MTC nhỏ nhất là \\(2x(x-1)\\)."
    },
    {
      "id": "RAT07READY_006",
      "type": "mcq",
      "skill": "cong-tru-phan-thuc",
      "points": 1,
      "question": "Tính \\(\\frac1x+\\frac1{x+1}\\), với \\(x\\ne0,-1\\).",
      "options": [
        "\\(\\frac{2x+1}{x(x+1)}\\)",
        "\\(\\frac2{2x+1}\\)",
        "\\(\\frac1{x(x+1)}\\)",
        "\\(\\frac{2x+1}{2x(x+1)}\\)"
      ],
      "answer": 0,
      "explanation": "Quy đồng về mẫu \\(x(x+1)\\): tử mới là \\((x+1)+x=2x+1\\)."
    },
    {
      "id": "RAT07READY_007",
      "type": "mcq",
      "skill": "cong-tru-phan-thuc",
      "supporting_skills": [
        "bo-ngoac-dau"
      ],
      "points": 1,
      "question": "Tính \\(\\frac{2x+1}{x-1}-\\frac{x-3}{x-1}\\), với \\(x\\ne1\\).",
      "options": [
        "\\(\\frac{x+4}{x-1}\\)",
        "\\(\\frac{x-2}{x-1}\\)",
        "\\(\\frac{x-4}{x-1}\\)",
        "\\(\\frac{3x-2}{x-1}\\)"
      ],
      "answer": 0,
      "explanation": "\\((2x+1)-(x-3)=2x+1-x+3=x+4\\)."
    },
    {
      "id": "RAT07READY_008",
      "type": "mcq",
      "skill": "nhan-phan-thuc",
      "points": 1,
      "question": "Tính \\(\\frac{x}{x+1}\\cdot\\frac{x+1}{2x}\\), với \\(x\\ne0,-1\\).",
      "options": [
        "\\(\\frac12\\)",
        "\\(2\\)",
        "\\(\\frac{x}{2}\\)",
        "\\(\\frac{x+1}{2x}\\)"
      ],
      "answer": 0,
      "explanation": "Rút các nhân tử chung \\(x\\) và \\(x+1\\), kết quả là \\(1/2\\)."
    },
    {
      "id": "RAT07READY_009",
      "type": "mcq",
      "skill": "chia-phan-thuc",
      "points": 1,
      "question": "Với \\(x\\ne0, y\\ne0\\), tính \\(\\frac{x}{y}:\\frac{x^2}{y^2}\\).",
      "options": [
        "\\(\\frac{y}{x}\\)",
        "\\(\\frac{x}{y}\\)",
        "\\(\\frac{x^3}{y^3}\\)",
        "\\(\\frac{y^3}{x^3}\\)"
      ],
      "answer": 0,
      "explanation": "Đổi phép chia thành nhân với nghịch đảo: \\(\\frac{x}{y}\\cdot\\frac{y^2}{x^2}=\\frac{y}{x}\\)."
    },
    {
      "id": "RAT07READY_010",
      "type": "mcq",
      "skill": "tinh-gia-tri-phan-thuc",
      "supporting_skills": [
        "rut-gon-phan-thuc"
      ],
      "points": 1,
      "question": "Cho \\(P=\\frac{x^2-1}{x-1}\\), \\(x\\ne1\\). Giá trị của \\(P\\) tại \\(x=3\\) là:",
      "options": [
        "4",
        "2",
        "8",
        "Không xác định"
      ],
      "answer": 0,
      "explanation": "Rút gọn \\(P=x+1\\) trên miền \\(x\\ne1\\). Tại \\(x=3\\), \\(P=4\\)."
    },
    {
      "id": "RAT07READY_011",
      "type": "mcq",
      "skill": "giu-dieu-kien-ban-dau",
      "points": 1,
      "question": "Cho \\(P=\\frac{(x-2)(x+1)}{x-2}\\). Sau khi rút gọn được \\(P=x+1\\), điều kiện nào vẫn phải giữ?",
      "options": [
        "\\(x\\ne2\\)",
        "\\(x\\ne-1\\)",
        "Mọi số thực \\(x\\)",
        "\\(x=2\\)"
      ],
      "answer": 0,
      "explanation": "Biểu thức ban đầu có mẫu \\(x-2\\), nên phải có \\(x\\ne2\\). Điều kiện này vẫn được giữ sau khi rút gọn.",
      "curriculum": {
        "book": "KNTT",
        "grades": [
          8
        ],
        "level": "core"
      },
      "authoring_review": {
        "status": "PASS",
        "method": "INDEPENDENT_NOTEBOOKLM_CONTENT_REVIEW",
        "packet_id": "MATH-READINESS-IMPLEMENTATION-W1-R1-20261010",
        "clearance": "READINESS_IMPLEMENTATION_W1_R1_CONTENT_REVIEW_COMPLETE",
        "review_date": "2026-10-10",
        "receipt": "review-packets/readiness-implementation-wave1-r1/03_NOTEBOOKLM_RESULT_R1.md",
        "base_priority_clearance": "READINESS_COVERAGE_PRIORITY_R1_REVIEW_COMPLETE",
        "priority_receipt": "review-packets/readiness-coverage-priority-r1/03_NOTEBOOKLM_RESULT_R1.md"
      }
    }
  ],
  "next_topic": {
    "id": "08-phuong-trinh-bat-phuong-trinh",
    "title": "Chuyên đề 08 – Phương trình và bất phương trình"
  }
}
