{
  "schema": "roadmap-readiness-assessment-v1",
  "version": 1,
  "assessment_id": "SYS09-CORE-READY-V1",
  "topic": {
    "id": "09-he-phuong-trinh",
    "title": "Chuyên đề 09 – Hệ phương trình bậc nhất hai ẩn"
  },
  "layer": "KNTT-Core",
  "title": "Core Readiness Check – Chuyên đề 09 – Hệ phương trình bậc nhất hai ẩn",
  "skill_labels": {
    "nghiem-pt-hai-an": "Nghiệm phương trình hai ẩn",
    "nghiem-he": "Nghiệm của hệ",
    "so-nghiem-he": "Số nghiệm của hệ",
    "y-nghia-hinh-hoc": "Ý nghĩa hình học",
    "giai-he-the": "Phương pháp thế",
    "giai-he-cong": "Cộng đại số",
    "chon-phuong-phap": "Chọn phương pháp",
    "kiem-tra-nghiem-he": "Kiểm tra nghiệm",
    "lap-he-bai-toan": "Lập hệ từ bài toán",
    "bai-toan-so": "Bài toán về số",
    "chuyen-dong-he": "Bài toán chuyển động",
    "nang-suat-he": "Bài toán năng suất"
  },
  "policy": {
    "feedback": "after_submit",
    "hints": false,
    "tutor": false,
    "hard_gate": false,
    "target_minutes": 20,
    "allow_partial_submit": true
  },
  "readiness": {
    "ready_threshold": 0.8,
    "minimum_answered_ratio": 0.8,
    "hard_gate": false,
    "states": [
      "READY",
      "REVIEW_RECOMMENDED",
      "MORE_EVIDENCE_NEEDED"
    ]
  },
  "items": [
    {
      "id": "SYS09READY_001",
      "type": "mcq",
      "skill": "nghiem-pt-hai-an",
      "points": 1,
      "question": "Cặp nào thỏa \\(2x+y=5\\)?",
      "options": [
        "\\((2;1)\\)",
        "\\((1;1)\\)",
        "\\((3;0)\\)",
        "\\((0;4)\\)"
      ],
      "answer": 0,
      "explanation": "2·2+1=5."
    },
    {
      "id": "SYS09READY_002",
      "type": "mcq",
      "skill": "nghiem-he",
      "points": 1,
      "question": "Cặp \\((3;2)\\) có thỏa hệ \\(x+y=5\\), \\(2x-y=4\\) không?",
      "options": [
        "Có",
        "Không, sai phương trình đầu",
        "Không, sai phương trình hai",
        "Không, sai cả hai"
      ],
      "answer": 0,
      "explanation": "3+2=5 và 6-2=4."
    },
    {
      "id": "SYS09READY_003",
      "type": "mcq",
      "skill": "so-nghiem-he",
      "points": 1,
      "question": "Hệ \\(x+2y=5\\), \\(2x+4y=10\\) có:",
      "options": [
        "Vô số nghiệm",
        "Một nghiệm",
        "Vô nghiệm",
        "Hai nghiệm"
      ],
      "answer": 0,
      "explanation": "Hai phương trình tương đương.",
      "supporting_skills": [
        "y-nghia-hinh-hoc"
      ]
    },
    {
      "id": "SYS09READY_004",
      "type": "mcq",
      "skill": "giai-he-the",
      "points": 1,
      "question": "Giải hệ \\(y=x+1\\), \\(2x+y=7\\).",
      "options": [
        "\\((2;3)\\)",
        "\\((3;2)\\)",
        "\\((1;2)\\)",
        "\\((2;5)\\)"
      ],
      "answer": 0,
      "explanation": "Thế y=x+1 được 3x+1=7."
    },
    {
      "id": "SYS09READY_005",
      "type": "mcq",
      "skill": "giai-he-cong",
      "points": 1,
      "question": "Giải hệ \\(x+y=6\\), \\(2x-y=3\\).",
      "options": [
        "\\((3;3)\\)",
        "\\((2;4)\\)",
        "\\((4;2)\\)",
        "\\((1;5)\\)"
      ],
      "answer": 0,
      "explanation": "Cộng hai phương trình được 3x=9."
    },
    {
      "id": "SYS09READY_006",
      "type": "mcq",
      "skill": "chon-phuong-phap",
      "points": 1,
      "question": "Hệ \\(x=2y-1\\), \\(x+y=8\\) thuận lợi nhất với:",
      "options": [
        "Phương pháp thế",
        "Cộng đại số",
        "Đồ thị",
        "Không cần giải"
      ],
      "answer": 0,
      "explanation": "x đã được cô lập."
    },
    {
      "id": "SYS09READY_007",
      "type": "mcq",
      "skill": "kiem-tra-nghiem-he",
      "points": 1,
      "question": "Cặp \\((2;3)\\) có thỏa \\(x+y=5\\), \\(3x-y=3\\) không?",
      "options": [
        "Có",
        "Chỉ thỏa phương trình đầu",
        "Chỉ thỏa phương trình hai",
        "Không thỏa phương trình nào"
      ],
      "answer": 0,
      "explanation": "2+3=5 và 6-3=3."
    },
    {
      "id": "SYS09READY_008",
      "type": "mcq",
      "skill": "lap-he-bai-toan",
      "points": 1,
      "question": "Tổng hai số 30, số lớn hơn số bé 8. Hệ đúng là:",
      "options": [
        "\\(x+y=30,\\ x-y=8\\)",
        "\\(x-y=30,\\ x+y=8\\)",
        "\\(xy=30,\\ x-y=8\\)",
        "\\(x+y=30,\\ y-x=8\\)"
      ],
      "answer": 0,
      "explanation": "Tổng và hiệu được chuyển thành hai phương trình."
    },
    {
      "id": "SYS09READY_009",
      "type": "mcq",
      "skill": "bai-toan-so",
      "points": 1,
      "question": "Số hai chữ số có hàng chục x, hàng đơn vị y được viết:",
      "options": [
        "\\(10x+y\\)",
        "\\(x+10y\\)",
        "\\(xy\\)",
        "\\(x+y\\)"
      ],
      "answer": 0,
      "explanation": "Giá trị hàng chục là 10x."
    },
    {
      "id": "SYS09READY_010",
      "type": "mcq",
      "skill": "chuyen-dong-he",
      "points": 1,
      "question": "Hai xe có tổng vận tốc 100 km/h, xe A hơn xe B 20 km/h. Vận tốc là:",
      "options": [
        "60 và 40",
        "70 và 30",
        "50 và 50",
        "80 và 20"
      ],
      "answer": 0,
      "explanation": "Giải hệ x+y=100, x-y=20.",
      "supporting_skills": [
        "lap-he-bai-toan",
        "giai-he-cong"
      ]
    }
  ],
  "next_topic": {
    "id": "10-ham-so-do-thi",
    "title": "Chuyên đề 10 – Hàm số và đồ thị"
  }
}
